date,tracking_id,category,source,price,name,mall,url,product_id,image
2026-06-16,p1,protein,naver,5900,마이프로틴 임팩트웨이 유청 단백질 보충제 쉐이크 샘플 바닐라 스테비아맛 25g 필수 아미노산 WPC BCAA,까까조,https://smartstore.naver.com/main/products/5785503248,83330002662,
2026-06-16,p2,protein,naver,13900,옵티멈뉴트리션 골드스탠다드웨이 프로틴 쉐이크 325ml 4개입,몬스터플렉스,https://smartstore.naver.com/main/products/10079261885,87623764538,
2026-06-16,c1,creatine,naver,16900,마이프로틴 크레아틴 부스터 임팩트 크레아틴 모노하이드레이트 무맛 100g 250g,윰플레이스,https://smartstore.naver.com/main/products/10393104147,87937609006,
2026-06-16,c2,creatine,naver,22000,옵티멈 뉴트리션 마이크로나이즈드 크레아틴 모노하이드레이트 100캡슐,에너지풀,https://smartstore.naver.com/main/products/13085714943,90630226035,
2026-06-16,b1,booster,naver,3800,삼대오백 헬스부스터 프리워크아웃 오리지널 70g 1포,더마켓마켓,https://smartstore.naver.com/main/products/13632552034,91177062698,
2026-06-16,g1,guard,naver,770,손목밴드 아대 보호대 땀방지 리스트랩 농구,카이로스컨퍼니,https://smartstore.naver.com/main/products/9023487506,86567987829,
2026-06-16,g2,guard,naver,14410,매드포머슬 니슬리브 무릎보호대 네오프렌 관절보호 sbd  7mm  M  1개,쿠팡,https://link.coupang.com/re/PCSNAVERPCSDP?pageKey=8502743014&ctag=8502743014&lptag=I5794122222&itemId=5794122222&vendorItemId=73092727363&spec=10305199,39923634994,
2026-06-16,e1,etc,naver,5900,마이프로틴 임팩트웨이 유청 단백질 보충제 쉐이크 샘플 골드 시럽맛 25g 필수 아미노산 WPC BCAA,까까조,https://smartstore.naver.com/main/products/5785476014,83329975428,
2026-06-16,e3,etc,naver,6900,락앤락 쉐이커 보틀 쉐이크통 헬스 물통 트라이탄 클래식 믹서 돔타입 680ml,유로키친,https://smartstore.naver.com/main/products/10948369824,88492875859,
2026-06-16,p1,protein,naver,5900,마이프로틴 임팩트웨이 유청 단백질 보충제 쉐이크 샘플 초코브라우니맛 25g 필수 아미노산 WPC BCAA,까까조,https://smartstore.naver.com/main/products/5784847101,83329346515,
2026-06-16,p2,protein,naver,25000,마이프로틴 임팩트 웨이 프로틴 통단팥 250g 1kg,YOUR  FAVORITE,https://smartstore.naver.com/main/products/9179407317,86723907640,
2026-06-16,p3,protein,naver,32900,"마이프로틴 웨이 임팩트 WHEY IMPACT 프로테인 스트로베리크림, 2.5KG",재팬방,http://japanbang.kr/mall/view/goodsNo/223194,31573982419,
2026-06-16,p4,protein,naver,35500,옵티멈뉴트리션 골드스탠다드 웨이 프로틴 454g 더블리치 초콜릿 유청단백질,시작스토어,https://smartstore.naver.com/main/products/6636002800,84180503122,
2026-06-16,p5,protein,naver,13900,옵티멈뉴트리션 골드스탠다드웨이 프로틴 쉐이크 325ml 4개입,몬스터플렉스,https://smartstore.naver.com/main/products/10079261885,87623764538,
2026-06-16,p6,protein,naver,72600,옵티멈 뉴트리션골드 스탠다드 100%카제인 프로틴 파우더 바닐라 24서빙 907g,세이비타,https://smartstore.naver.com/main/products/8238639384,85783139707,
2026-06-16,p7,protein,naver,47400,"BSN 신타6 울트라 프리미엄 프로틴 매트릭스 초콜릿 밀크쉐이크 , 2.27kg, 1개",네이버,https://search.shopping.naver.com/catalog/53647415369,53647415369,
2026-06-16,p8,protein,naver,15000,신타6 프리미엄 쉐이커 700ml / 단백질보충제 전용 쉐이커,BSN 신타 6,https://smartstore.naver.com/main/products/9033510065,86578010388,
2026-06-16,p9,protein,naver,162500,다이마타이즈 아이소100 WPIH 아이솔레이트 ISO 분리유청 단백질 초코2.3kg,다리마케트,https://smartstore.naver.com/main/products/8725078419,86269578742,
2026-06-16,p10,protein,naver,30410,운동을 위한 엘리트 스포츠 코어 슬라이더 - 카펫이나 하드우드 바닥에서 전신 컴팩트 양면,뉴웨이커머스,https://smartstore.naver.com/main/products/13535386414,91079896767,
2026-06-16,p11,protein,naver,69900,머슬팜 컴뱃 프로틴 초코 52서빙 1.8kg,루비타몰,https://smartstore.naver.com/main/products/9368706931,86913207254,
2026-06-16,p12,protein,naver,2200,칼로바이 퍼펙트 파워쉐이크 20G (초코맛/딸기맛),올리브영,https://www.oliveyoung.co.kr/store/common/partner.do?chlNo=1&chlDtlNo=1&utm_source=naver&utm_medium=shopping_ep&utm_campaign=onpro_ep_product_0101_1231&utm_content=pc_price&sndType=goods&sndVal=A000000211332,59094845665,
2026-06-16,p13,protein,naver,43900,이선 칼로바이 퍼펙트 파워쉐이크 게이너 곡물맛,네이버,https://search.shopping.naver.com/catalog/56468346359,56468346359,
2026-06-16,p14,protein,naver,3900,"스포츠바이오텍 마이프로틴 단백질 쉐이크 코코 초코, 45g, 1개",네이버,https://search.shopping.naver.com/catalog/59320018194,59320018194,
2026-06-16,p15,protein,naver,20900,마이프로틴 비건 프로틴 블렌드 6서빙 초코 아이스커피 단백질 쉐이크 파우치 보리 다이어트,윰플레이스,https://smartstore.naver.com/main/products/10444334590,87988839639,
2026-06-16,p16,protein,naver,52300,옵티멈뉴트리션 골드 스탠다드 100% 플랜트프로틴 식물성프로틴 리치 초코 퍼지 800g,펀대행마켓,https://smartstore.naver.com/main/products/12186432046,89730942751,
2026-06-16,p17,protein,naver,24410,뉴트리코스트 타우린 파우더 500g 아이솔레이트,TAERIMY,https://smartstore.naver.com/main/products/10480726187,88025231488,
2026-06-16,p18,protein,naver,49900,MYPROTEIN 마이프로틴 임팩트 웨이트 게이너 블랜드(1kg~2.5kg),아름팜,https://smartstore.naver.com/main/products/8846314220,86390814543,
2026-06-16,p19,protein,naver,69900,옵티멈뉴트리션 시리어스 매스 초콜릿 피넛 버터 2.72kg 게이너 벌크업 보충제,LUXE J,https://smartstore.naver.com/main/products/12078468146,89622978845,
2026-06-16,p20,protein,naver,83900,신타6 트루매스 바닐라 아이스크림 2.64kg,로컬비타,https://smartstore.naver.com/main/products/9490012703,87034513026,
2026-06-16,p21,protein,naver,26900,마이프로틴 육겹바 레이어드바 쿠키 크럼블 맛 6개입 다이어트 식사대용 간식 단백질 쿠키,윰플레이스,https://smartstore.naver.com/main/products/10404510079,87949014972,
2026-06-16,p22,protein,naver,4700,[퀘스트 프로틴 바] 초콜릿 칩 쿠키 도우 프로틴 바 60g,호주공구,http://hoju09.co.kr/shop/goods/goods_view.php?goodsno=39763&inflow=naver,12807678958,
2026-06-16,p23,protein,naver,13300,마이 프로틴 호에이・Impact 호에이푸로테인 1kg 쿠키 앤드 크림,재팬봉,http://japanbong.co.kr/mall/view/goodsNo/50551,27837439814,
2026-06-16,p25,protein,naver,43900,마이프로틴 클리어 웨이 프로틴 아이솔레이트 20서빙 크랜베리 라즈베리,윰플레이스,https://smartstore.naver.com/main/products/10258533190,87803036913,
2026-06-16,p26,protein,naver,17860,코어 파워 페어라이프 26g 단백질 우유 쉐이크 운동 회복 액상 즉석 음료 바닐라 414ml 병 코셔 (12개 묶음)  딸기바나나  1개,쿠팡,https://link.coupang.com/re/PCSNAVERPCSDP?pageKey=8311849874&ctag=8311849874&lptag=I28478373992&itemId=28478373992&vendorItemId=94936573798&spec=10305199,60067765977,
2026-06-16,p27,protein,naver,6900,"[1박스/15포] 바디닥터스 마시는 알부민 골드 300g, 1개",바디닥터스 공식스토어,https://smartstore.naver.com/main/products/13231867407,90776377738,
2026-06-16,p28,protein,naver,1750,"칼로바이 프로틴 스파클링 단백질 보충제 무설탕 탄산 음료 포도맛 340ml, 1개",더베네푸드 다이어트,https://smartstore.naver.com/main/products/12679361623,90223872547,
2026-06-16,p29,protein,naver,12500,네덜란드 분말 알라 파우더 덴마크산 단백질보충제 프로틴 음료 산양유단100,원데이뉴트리션,https://smartstore.naver.com/main/products/6961170563,84505670885,
2026-06-16,p30,protein,naver,32000,식스 스타 엘리트 시리즈 100% 웨이 프로틴 플러스 18회분,오빌의금,https://smartstore.naver.com/main/products/7028820908,84573321230,
2026-06-16,p31,protein,naver,66800,뉴트라바이오 클리어 아이솔레이트 웨이 프로틴 파우더 워터멜론 브리즈 494g,G마켓,https://link.gmarket.co.kr/gate/pcs?item-no=3517770032&sub-id=1003&service-code=10000003&lcd=100000037,60376413518,
2026-06-16,p32,protein,naver,12200,"마이 프로틴 호에이・Impact 호에이푸로테인 스트로우베리 잼・롤리・폴리,1kg",재팬봉,http://japanbong.co.kr/mall/view/goodsNo/35077,27837430784,
2026-06-16,p33,protein,naver,45220,"OptImum NutrItIon Gold Standard 100 유청 단백질 파우더 (근육 증강 및 용), 타민 BCAA 아미노산 함유, 맛있는 딸기 맛, 10회분, 300g [B",Small Sense,https://smartstore.naver.com/main/products/13339586144,90884096476,
2026-06-16,p36,protein,naver,55800,머슬팜 컴뱃 100% 웨이 프로틴 파우더 드링크 믹스 초콜릿 밀크,네이버,https://search.shopping.naver.com/catalog/35341596618,35341596618,
2026-06-16,c1,creatine,naver,16900,마이프로틴 크레아틴 부스터 임팩트 크레아틴 모노하이드레이트 무맛 100g 250g,윰플레이스,https://smartstore.naver.com/main/products/10393104147,87937609006,
2026-06-16,c2,creatine,naver,16900,마이프로틴 크레아틴 부스터 임팩트 크레아틴 모노하이드레이트 무맛 100g 250g,윰플레이스,https://smartstore.naver.com/main/products/10393104147,87937609006,
2026-06-16,c3,creatine,naver,24500,옵티멈뉴트리션 마이크로나이즈드 크레아틴 파우더 무맛 300g,비타프로,https://smartstore.naver.com/main/products/6965705048,84510205370,
2026-06-16,c4,creatine,naver,27900,옵티멈 뉴트리션 크레아틴 2500mg 100정 캡슐,LUXE J,https://smartstore.naver.com/main/products/11557904951,89102415357,
2026-06-16,c5,creatine,naver,15690,[미국번개배송] 신제품 착한명품 마이라이프 내추럴스 마이크로나이즈드 크레아틴 모노하이드레이트 (분말)  500g  1개,쿠팡,https://link.coupang.com/re/PCSNAVERPCSDP?pageKey=9017676892&ctag=9017676892&lptag=I26415886385&itemId=26415886385&vendorItemId=93391894215&spec=10305199,56483037527,
2026-06-16,c6,creatine,naver,14000,머슬팜 크레아틴 무맛 에센셜 퓨어 모노하이드레이트 파우더 언플레이버드 300g,선라이즈몰,https://smartstore.naver.com/main/products/11439506880,88984017245,
2026-06-16,c7,creatine,naver,35900,셀루코어 코어 퍼포먼스 크레아틴 360g,몬스터플렉스,https://smartstore.naver.com/main/products/8752644948,86297145271,
2026-06-16,c8,creatine,naver,18200,뉴트리코스트 크레아틴 모노하이드레이트 일수화물 무맛 300g,에덴웰니스,https://smartstore.naver.com/main/products/11877210983,89421721585,
2026-06-16,c10,creatine,naver,54530,"DNA 크레아틴 모노하이드레이트 파우더, 운동 전후 섭취용 스포츠 로 능력 향상 지원, 무향, 216g, 63회분 [B00WGOE1EY]",Small Sense,https://smartstore.naver.com/main/products/13327668206,90872178538,
2026-06-16,c11,creatine,naver,21720,식스스타 크레아틴 X3 60정,B.비블랑,https://smartstore.naver.com/main/products/13319387720,90863898052,
2026-06-16,c12,creatine,naver,3820,독일 크레아틴 모노 하이드레이트 헬스부스터 3000PUR 발포 20정,유로토탈,https://smartstore.naver.com/main/products/11504710181,89049220546,
2026-06-16,c13,creatine,naver,10500,독일산 프리미엄 크레아틴 모노하이드레이트 엔업 크레아틴 파워프로(3.5gx14포) 스틱,라이트에너지,https://smartstore.naver.com/main/products/12561598404,90106109257,
2026-06-16,c14,creatine,naver,16900,마이프로틴 크레아틴 부스터 임팩트 크레아틴 모노하이드레이트 무맛 100g 250g,윰플레이스,https://smartstore.naver.com/main/products/10393104147,87937609006,
2026-06-16,c15,creatine,naver,22000,옵티멈 뉴트리션 마이크로나이즈드 크레아틴 모노하이드레이트 100캡슐,에너지풀,https://smartstore.naver.com/main/products/13085714943,90630226035,
2026-06-16,c16,creatine,naver,18550,21세기 Full Fuel 365 크레아틴 일수화물 구미젤리 믹스 베리 맛 구미젤리 75개,원직구,https://www.onejikgu.co.kr/shop_view?idx=57954,60102565916,
2026-06-16,c17,creatine,naver,3820,독일 크레아틴 모노 하이드레이트 헬스부스터 3000PUR 발포 20정,유로토탈,https://smartstore.naver.com/main/products/11504710181,89049220546,
2026-06-16,c19,creatine,naver,11900,크레아틴 모노하이드레이트 3000,칼로바이,http://www.calobye.shop/view.php?num=2485&pid=naverdb,46223107901,
2026-06-16,c20,creatine,naver,16900,마이프로틴 크레아틴 부스터 임팩트 크레아틴 모노하이드레이트 무맛 100g 250g,윰플레이스,https://smartstore.naver.com/main/products/10393104147,87937609006,
2026-06-16,c21,creatine,naver,9900,나우푸드 파우더 퓨어 크레아틴 모노하이드레이트 227g,헬씨픽스,https://smartstore.naver.com/main/products/12077125314,89621636013,
2026-06-16,c22,creatine,naver,24900,머슬테크 셀테크 셀텍 크리에이터 크레아틴 HCI 무맛 235g,LUXE J,https://smartstore.naver.com/main/products/11662915245,89207425712,
2026-06-16,g1,guard,naver,990,데드리프트 웨이트 헬스 리프팅 그립 스트랩 손목 보호대 아대,만물상점 스마트점,https://smartstore.naver.com/main/products/6571834479,84116334812,
2026-06-16,g2,guard,naver,7000,손목 결절종 헬스 스트랩 가죽 sbd 리스트랩 시크 스트랩 손고정,빈즈몰,http://reknit0013.godomall.com/goods/goods_view.php?goodsNo=1000346264&inflow=naver,55503517008,
2026-06-16,g3,guard,naver,7000,반품/KM 베어컴플렉스 카본 콤프 3홀 그립 손바닥보호대,펀키보이,https://www.funkeyboy.co.kr/goods/goods_view.php?goodsNo=1000038916&inflow=naver,21492240525,
2026-06-16,g4,guard,naver,5600,피지컬프로 니 슬리브 무릎 압박 재활 밴드 보호대 네오프렌 5mm 7mm,힘쎈스포츠,https://smartstore.naver.com/main/products/5155230910,82699751833,
2026-06-16,g5,guard,naver,14410,매드포머슬 니슬리브 무릎보호대 네오프렌 관절보호 sbd  7mm  M  1개,쿠팡,https://link.coupang.com/re/PCSNAVERPCSDP?pageKey=8502743014&ctag=8502743014&lptag=I5794122222&itemId=5794122222&vendorItemId=73092727363&spec=10305199,39923634994,
2026-06-16,g6,guard,naver,2410,라이크미 땡큐 면 무릎 보호대 lm0119,네이버,https://search.shopping.naver.com/catalog/58341402578,58341402578,
2026-06-16,g7,guard,naver,920,얇은 발목 보호대 손목 키퍼 무릎 연골 골프 엘보 4종 아대 발등 통증 아킬레스건 볼링 아데 팔꿈치 군대 댄스 스쿼트 배구 테니스 엘보우 슬리브 작업용 축구 등산 슬개골 니슬리브,해브펀 HaveFun,https://smartstore.naver.com/main/products/9866071860,87410574133,
2026-06-16,g8,guard,naver,6800,팔 보호대 한쌍 팔꿈치 보호대 sbd 테니스 엘보우 헬스 팔꿈치,더블유엠유세컨드,http://reknit0011.godomall.com/goods/goods_view.php?goodsNo=1000507214&inflow=naver,55503600481,
2026-06-16,g9,guard,naver,1020,측정도구 체형측정 원터치벨트 허리청결기 건조기벨트 허리보호대 가죽허리줄자 원터치 허리줄자,롯데ON,https://www.lotteon.com/p/product/LO2598016083?sitmNo=LO2598016083_2598016084&ch_no=100065&ch_dtl_no=1000030&entryPoint=pcs&dp_infw_cd=CHT,58328024884,
2026-06-16,g10,guard,naver,32900,콤마스포츠 이중잠금 버클 웨이트 복압벨트 SBD 나일론 허리보호대 파워리프팅 역도 크로스핏,콤마스포츠,https://smartstore.naver.com/main/products/11127647782,88672158104,
2026-06-16,g11,guard,naver,3078,"덤벨 리프팅 스트랩 2개, 역도 손목 스트랩, 바벨 웨이트 세트용 웨이트 리프팅 스트랩, 역도, 보디빌딩, 파워리프팅, 근력 운동, 데드리프트, 보디빌딩 운동용품, 헬스장용",TEMU kr,https://temuaffiliateprogram.pxf.io/c/5257454/1580294/18350?u=https%3A%2F%2Fwww.temu.com%2Fkr%2Fgoods.html%3Fsku_id%3D17612529393415%26goods_id%3D601103977543897%26_x_ns_catalog_id%3D10000%26_x_ns_product_id%3D17612529393415%26_x_ns_site_id%3D119%26_x_ns_ad%3d{ad},60121990860,
2026-06-16,g12,guard,naver,140,성원 프라이드 각반 청색 1개,네이버,https://search.shopping.naver.com/catalog/59548437826,59548437826,
2026-06-16,g13,guard,naver,20,17cm 얇은 손목 스트랩 끈(5컬러),앤디미로,https://smartstore.naver.com/main/products/12686252908,90230763832,
2026-06-16,g14,guard,naver,1310,스트랩 그립 라켓,캔디베어샵,https://smartstore.naver.com/main/products/12964535602,90509046612,
2026-06-16,g15,guard,naver,50,노마드 손가락 마디 보호 자가접착 쿠션테이프 OC1079,네이버,https://search.shopping.naver.com/catalog/31279343393,31279343393,
2026-06-16,g16,guard,naver,10,무릎보호대 1개 런닝 헬스 러닝무릎보호대 니슬리브 무릎밴드 아대 관절 배구 등산무릎보호대,케이제이하우스,https://smartstore.naver.com/main/products/13297513212,90842023544,
2026-06-16,b1,booster,naver,27900,C4부스터 프리워크아웃 오리지널 핑크 레몬에이드,헬로플레이,https://smartstore.naver.com/main/products/10346140313,87890644756,
2026-06-16,b3,booster,naver,800,고프로 퀵버클 퀵릴리즈 마운트 악세사리,낙원카메라,https://smartstore.naver.com/main/products/479427917,10276312885,
2026-06-16,b4,booster,naver,40600,BSN 노익스플로드 프리워크아웃 파우더 망고 시트러스맛  1개  540g,쿠팡,https://link.coupang.com/re/PCSNAVERPCSDP?pageKey=8620275185&ctag=8620275185&lptag=I28442389952&itemId=28442389952&vendorItemId=95393119160&spec=10305199,59995746408,
2026-06-16,b6,booster,naver,22900,바이오로제트 삼대오백 헬스부스터 프리워크아웃 (프로1 액상 70g + 프로2 정제 1800mg ) x 15포,네이버,https://search.shopping.naver.com/catalog/40037145621,40037145621,
2026-06-16,b7,booster,naver,12700,Optimum Nutrition Gold Standard 단백질 셰이크 초콜릿 4팩 각 325ml(11fl oz),빌리온몰,https://smartstore.naver.com/main/products/12960286878,90504797888,
2026-06-16,b9,booster,naver,34020,"[iHerb 공식] MusclePharm, Assault 프리워크아웃, 과일 펀치 맛, 344g(12.1oz)",11번가,https://www.11st.co.kr/connect/Gateway.tmall?method=Xsite&prdNo=8613636609&tid=1000000061,56499056395,
2026-06-16,b10,booster,naver,29000,GAT NITRAFLEX 니트라플렉스 30서빙,HB 라이프,https://smartstore.naver.com/main/products/7679384145,85223884467,
2026-06-16,b11,booster,naver,9580,부스터 수압상승 샤워기 사이클론 고압 헤드 필터형 절수,봄가을사무실가정용선반작업복,https://smartstore.naver.com/main/products/13142982209,90687493301,
2026-06-16,b12,booster,naver,17500,마이프로틴 베타알라닌 아미노산 무맛 250g BETA 프리워크아웃 헬스부스터 근육 펌핑,윰플레이스,https://smartstore.naver.com/main/products/10404116967,87948621860,
2026-06-16,b13,booster,naver,48160,식스 스타 프리워크아웃 익스플로전 포도맛 30인분 남녀용 운동 전 에너지 파우더 L티로신과 베타 알라닌이 함 포도 V2,나인6,https://smartstore.naver.com/main/products/12449508323,89994019070,
2026-06-16,e1,etc,naver,26900,마이프로틴 글루타민 아미노산 250정,유라헬,https://smartstore.naver.com/main/products/11122262428,88666772750,
2026-06-16,e2,etc,naver,5900,마이프로틴 임팩트웨이 유청 단백질 보충제 쉐이크 샘플 복숭아 아이스티맛 25g 필수 아미노산 WPC BCAA,까까조,https://smartstore.naver.com/main/products/5785506456,83330005870,
2026-06-16,e3,etc,naver,14770,최적의 아미노 에너지 스파클링 하이드레이션 전해질 카페인 아미노산 BCAA 무설탕 쥬시 체리 2 Fl Oz 카운트(포장은 다를 수 ) 1 Count (Pack of 1),베리파빌리온,https://smartstore.naver.com/main/products/13451675728,90996186080,
2026-06-16,e4,etc,naver,44800,Cellucor 알파 아미노 BCAA 파우더 워터멜론 30회분,PLAYERS LOUNGE,https://smartstore.naver.com/main/products/10228169067,87772672618,
2026-06-16,e5,etc,naver,17500,마이프로틴 L-글루타민 아미노산 250g 무맛,YOUR  FAVORITE,https://smartstore.naver.com/main/products/8646418129,86190918452,
2026-06-16,e6,etc,naver,26400,"Myprotein 크레아틴 모노하이드레이트 파우더, 50회 분량 (0.2kg(0.5파운드) 순수 무향 모든 스포츠 및 운동을 위한 운동 후/운동 전 보충제 268107",성실청년과일샵,https://smartstore.naver.com/main/products/12928543049,90473054041,
2026-06-16,e7,etc,naver,10900,마이프로틴 L‐ 글루퍼터민 파우더250G 무미,재팬방,http://japanbang.kr/mall/view/goodsNo/362957,23050576221,
2026-06-16,e8,etc,naver,6900,락앤락 쉐이커 보틀 쉐이크통 헬스 물통 트라이탄 클래식 믹서 돔타입 680ml,유로키친,https://smartstore.naver.com/main/products/10948369824,88492875859,
2026-06-16,e9,etc,naver,28960,블렌더 보틀 프로 시리즈 Pro24FC 패키지 710ml(24oz)  블렌더보틀프로시리즈Pro24FC패키지710ml24oz,쿠팡,https://link.coupang.com/re/PCSNAVERPCSDP?pageKey=8634640342&ctag=8634640342&lptag=I25052749334&itemId=25052749334&vendorItemId=92057332858&spec=10305199,60330174875,
2026-06-16,e10,etc,naver,17760,옵티멈 멀티비타민 앤 미네랄 포우먼 90정 1개,11번가,https://www.11st.co.kr/connect/Gateway.tmall?method=Xsite&prdNo=8939835512&tid=1000000061,58145599306,
2026-06-16,e11,etc,naver,9890,나우푸드 오메가3 소프트젤 1000mg 피쉬오일 100정 180EPA 120DHA,키핏올,https://smartstore.naver.com/main/products/7673036511,85217536833,
2026-06-16,e12,etc,naver,24500,마이프로틴 알파맨 멀티비타민 60정,YOUR  FAVORITE,https://smartstore.naver.com/main/products/9360259659,86904759982,
2026-06-16,e13,etc,naver,5900,마이프로틴 임팩트웨이 유청 단백질 보충제 쉐이크 샘플 초코브라우니맛 25g 필수 아미노산 WPC BCAA,까까조,https://smartstore.naver.com/main/products/5784847101,83329346515,
2026-06-16,p1,protein,naver,5900,마이프로틴 임팩트웨이 유청 단백질 보충제 쉐이크 샘플 초코브라우니맛 25g 필수 아미노산 WPC BCAA,까까조,https://smartstore.naver.com/main/products/5784847101,83329346515,
2026-06-16,p2,protein,naver,5900,마이프로틴 임팩트웨이 유청 단백질 보충제 쉐이크 샘플 딸기잼 롤리폴리맛 25g 필수 아미노산 WPC BCAA,까까조,https://smartstore.naver.com/main/products/5785486351,83329985765,
2026-06-16,p3,protein,naver,5900,마이프로틴 임팩트웨이 유청 단백질 보충제 쉐이크 샘플 바닐라 스테비아맛 25g 필수 아미노산 WPC BCAA,까까조,https://smartstore.naver.com/main/products/5785503248,83330002662,
2026-06-16,p4,protein,naver,19900,마이프로틴 임팩트 웨이 프로틴 파우더 쿠키앤크림 250g 농축유청단백질,윰플레이스,https://smartstore.naver.com/main/products/10302183896,87846687910,
2026-06-16,p5,protein,naver,5900,마이프로틴 임팩트웨이 유청 단백질 보충제 쉐이크 샘플 초콜렛 바나나맛 25g 필수 아미노산 WPC BCAA,까까조,https://smartstore.naver.com/main/products/5785532504,83330031918,
2026-06-16,p6,protein,naver,5900,마이프로틴 임팩트웨이 유청 단백질 보충제 쉐이크 샘플 솔티드 캬라멜맛 25g 필수 아미노산 WPC BCAA,까까조,https://smartstore.naver.com/main/products/5785514743,83330014157,
2026-06-16,p7,protein,naver,5900,마이프로틴 임팩트웨이 유청 단백질 보충제 쉐이크 샘플 초코브라우니맛 25g 필수 아미노산 WPC BCAA,까까조,https://smartstore.naver.com/main/products/5784847101,83329346515,
2026-06-16,p8,protein,naver,5900,마이프로틴 임팩트웨이 유청 단백질 보충제 쉐이크 샘플 네추럴 딸기맛 25g 필수 아미노산 WPC BCAA,까까조,https://smartstore.naver.com/main/products/5785477708,83329977122,
2026-06-16,p9,protein,naver,5900,마이프로틴 임팩트웨이 유청 단백질 보충제 쉐이크 샘플 바닐라 라즈베리맛 25g 필수 아미노산 WPC BCAA,까까조,https://smartstore.naver.com/main/products/5785501325,83330000739,
2026-06-16,p10,protein,naver,19900,마이프로틴 임팩트 웨이 프로틴 파우더 쿠키앤크림 250g 농축유청단백질,윰플레이스,https://smartstore.naver.com/main/products/10302183896,87846687910,
2026-06-16,p11,protein,naver,5900,마이프로틴 임팩트웨이 유청 단백질 보충제 쉐이크 샘플 초콜렛 바나나맛 25g 필수 아미노산 WPC BCAA,까까조,https://smartstore.naver.com/main/products/5785532504,83330031918,
2026-06-16,p12,protein,naver,5900,마이프로틴 임팩트웨이 유청 단백질 보충제 쉐이크 샘플 솔티드 캬라멜맛 25g 필수 아미노산 WPC BCAA,까까조,https://smartstore.naver.com/main/products/5785514743,83330014157,
2026-06-16,p13,protein,naver,5900,마이프로틴 임팩트웨이 유청 단백질 보충제 쉐이크 샘플 초코브라우니맛 25g 필수 아미노산 WPC BCAA,까까조,https://smartstore.naver.com/main/products/5784847101,83329346515,
2026-06-16,p14,protein,naver,5900,마이프로틴 임팩트웨이 유청 단백질 보충제 쉐이크 샘플 딸기크림맛 25g 필수 아미노산 WPC BCAA,까까조,https://smartstore.naver.com/main/products/5785489558,83329988972,
